{
  "id": "mcol-filt01",
  "person_id": "person-pippa1",
  "kind": "filter",
  "title": "Short and new",
  "items": [],
  "pointer": null,
  "shared_to": null,
  "rules": {
    "unplayed": true,
    "max_minutes": 30,
    "source_ids": ["msrc-feed01"],
    "released_within_days": 14
  },
  "deleted_at": null,
  "trash_until": null,
  "created_at": "2026-10-28T09:00:00Z",
  "hlc": "1791547200000:0:hub001",
  "provenance": "hub"
}
