{
  "id": "mcol-watch01",
  "person_id": "person-pippa1",
  "kind": "watchlist",
  "title": "Watchlist",
  "items": [
    {
      "media_id": "media-ep0102",
      "added_at": "2026-10-17T11:00:00Z",
      "position": 0,
      "status": "watching"
    }
  ],
  "pointer": null,
  "shared_to": "household",
  "rules": null,
  "deleted_at": null,
  "trash_until": null,
  "created_at": "2026-10-17T11:00:00Z",
  "hlc": "1791547200000:0:hub001",
  "provenance": "hub"
}
